{"metadata":{"documentType":"TEMPLATE_COMBINATION","schemaVersion":1,"key":"TEN_K__4D__INTERMEDIATE","version":2,"status":"PUBLISHED","contentHash":"b3dab01388bfac1de820efa3649007e1bf3cfa1d4980e4070cd9cbacd15e8594"},"masterTemplate":{"documentType":"PLAN_TEMPLATE","key":"TEN_K_MASTER","version":2},"layout":{"documentType":"RUN_LAYOUT","key":"RUN_LAYOUT_4D","version":1},"levelModifier":{"documentType":"LEVEL_MODIFIER","key":"INTERMEDIATE_MODIFIER","version":1},"rulePack":{"documentType":"RULE_PACK","key":"APPSEL_RACE_PLAN_V1","version":1}}