{
  "metadata": {
    "documentType": "TEMPLATE_COMBINATION",
    "schemaVersion": 1,
    "key": "HALF_MARATHON__3D__ADVANCED",
    "version": 1,
    "status": "VALIDATED"
  },
  "masterTemplate": {
    "documentType": "PLAN_TEMPLATE",
    "key": "HALF_MARATHON_MASTER",
    "version": 1
  },
  "layout": {
    "documentType": "RUN_LAYOUT",
    "key": "RUN_LAYOUT_3D",
    "version": 1
  },
  "levelModifier": {
    "documentType": "LEVEL_MODIFIER",
    "key": "ADVANCED_MODIFIER",
    "version": 3
  },
  "rulePack": {
    "documentType": "RULE_PACK",
    "key": "APPSEL_RACE_PLAN_V1",
    "version": 10
  }
}
