{
  "metadata": {
    "documentType": "TEMPLATE_COMBINATION",
    "schemaVersion": 1,
    "key": "TEN_K__4D__BEGINNER",
    "version": 1,
    "status": "VALIDATED"
  },
  "masterTemplate": { "documentType": "PLAN_TEMPLATE", "key": "TEN_K_MASTER", "version": 6 },
  "layout": { "documentType": "RUN_LAYOUT", "key": "RUN_LAYOUT_4D", "version": 1 },
  "levelModifier": { "documentType": "LEVEL_MODIFIER", "key": "BEGINNER_MODIFIER", "version": 1 },
  "rulePack": { "documentType": "RULE_PACK", "key": "APPSEL_RACE_PLAN_V1", "version": 5 }
}
